[
  {
    "study_exercise_map_id": "sem_00001",
    "study_id": "stu_0004",
    "exercise_id": "ex_barbell_bench_press",
    "relationship_type": "movement_pattern_inference"
  },
  {
    "study_exercise_map_id": "sem_00002",
    "study_id": "stu_0005",
    "exercise_id": "ex_barbell_bench_press",
    "relationship_type": "movement_pattern_inference"
  },
  {
    "study_exercise_map_id": "sem_00003",
    "study_id": "stu_0007",
    "exercise_id": "ex_barbell_bench_press",
    "relationship_type": "movement_pattern_inference"
  },
  {
    "study_exercise_map_id": "sem_00004",
    "study_id": "stu_0008",
    "exercise_id": "ex_barbell_bench_press",
    "relationship_type": "movement_pattern_inference"
  },
  {
    "study_exercise_map_id": "sem_00005",
    "study_id": "stu_0009",
    "exercise_id": "ex_barbell_bench_press",
    "relationship_type": "movement_pattern_inference"
  },
  {
    "study_exercise_map_id": "sem_00006",
    "study_id": "stu_0010",
    "exercise_id": "ex_barbell_bench_press",
    "relationship_type": "movement_pattern_inference"
  },
  {
    "study_exercise_map_id": "sem_00007",
    "study_id": "stu_0011",
    "exercise_id": "ex_barbell_bench_press",
    "relationship_type": "movement_pattern_inference"
  },
  {
    "study_exercise_map_id": "sem_00008",
    "study_id": "stu_0012",
    "exercise_id": "ex_barbell_bench_press",
    "relationship_type": "movement_pattern_inference"
  },
  {
    "study_exercise_map_id": "sem_00009",
    "study_id": "stu_0004",
    "exercise_id": "ex_cambered_barbell_bench_press",
    "relationship_type": "movement_pattern_inference"
  },
  {
    "study_exercise_map_id": "sem_00010",
    "study_id": "stu_0005",
    "exercise_id": "ex_cambered_barbell_bench_press",
    "relationship_type": "movement_pattern_inference"
  },
  {
    "study_exercise_map_id": "sem_00011",
    "study_id": "stu_0007",
    "exercise_id": "ex_cambered_barbell_bench_press",
    "relationship_type": "movement_pattern_inference"
  },
  {
    "study_exercise_map_id": "sem_00012",
    "study_id": "stu_0008",
    "exercise_id": "ex_cambered_barbell_bench_press",
    "relationship_type": "movement_pattern_inference"
  },
  {
    "study_exercise_map_id": "sem_00013",
    "study_id": "stu_0009",
    "exercise_id": "ex_cambered_barbell_bench_press",
    "relationship_type": "movement_pattern_inference"
  },
  {
    "study_exercise_map_id": "sem_00014",
    "study_id": "stu_0010",
    "exercise_id": "ex_cambered_barbell_bench_press",
    "relationship_type": "movement_pattern_inference"
  },
  {
    "study_exercise_map_id": "sem_00015",
    "study_id": "stu_0011",
    "exercise_id": "ex_cambered_barbell_bench_press",
    "relationship_type": "movement_pattern_inference"
  },
  {
    "study_exercise_map_id": "sem_00016",
    "study_id": "stu_0012",
    "exercise_id": "ex_cambered_barbell_bench_press",
    "relationship_type": "movement_pattern_inference"
  },
  {
    "study_exercise_map_id": "sem_00017",
    "study_id": "stu_0004",
    "exercise_id": "ex_dumbbell_bench_press",
    "relationship_type": "movement_pattern_inference"
  },
  {
    "study_exercise_map_id": "sem_00018",
    "study_id": "stu_0005",
    "exercise_id": "ex_dumbbell_bench_press",
    "relationship_type": "movement_pattern_inference"
  },
  {
    "study_exercise_map_id": "sem_00019",
    "study_id": "stu_0007",
    "exercise_id": "ex_dumbbell_bench_press",
    "relationship_type": "movement_pattern_inference"
  },
  {
    "study_exercise_map_id": "sem_00020",
    "study_id": "stu_0008",
    "exercise_id": "ex_dumbbell_bench_press",
    "relationship_type": "movement_pattern_inference"
  },
  {
    "study_exercise_map_id": "sem_00021",
    "study_id": "stu_0009",
    "exercise_id": "ex_dumbbell_bench_press",
    "relationship_type": "movement_pattern_inference"
  },
  {
    "study_exercise_map_id": "sem_00022",
    "study_id": "stu_0010",
    "exercise_id": "ex_dumbbell_bench_press",
    "relationship_type": "movement_pattern_inference"
  },
  {
    "study_exercise_map_id": "sem_00023",
    "study_id": "stu_0011",
    "exercise_id": "ex_dumbbell_bench_press",
    "relationship_type": "movement_pattern_inference"
  },
  {
    "study_exercise_map_id": "sem_00024",
    "study_id": "stu_0012",
    "exercise_id": "ex_dumbbell_bench_press",
    "relationship_type": "movement_pattern_inference"
  },
  {
    "study_exercise_map_id": "sem_00025",
    "study_id": "stu_0004",
    "exercise_id": "ex_incline_dumbbell_press",
    "relationship_type": "movement_pattern_inference"
  },
  {
    "study_exercise_map_id": "sem_00026",
    "study_id": "stu_0005",
    "exercise_id": "ex_incline_dumbbell_press",
    "relationship_type": "movement_pattern_inference"
  },
  {
    "study_exercise_map_id": "sem_00027",
    "study_id": "stu_0007",
    "exercise_id": "ex_incline_dumbbell_press",
    "relationship_type": "movement_pattern_inference"
  },
  {
    "study_exercise_map_id": "sem_00028",
    "study_id": "stu_0008",
    "exercise_id": "ex_incline_dumbbell_press",
    "relationship_type": "movement_pattern_inference"
  },
  {
    "study_exercise_map_id": "sem_00029",
    "study_id": "stu_0009",
    "exercise_id": "ex_incline_dumbbell_press",
    "relationship_type": "movement_pattern_inference"
  },
  {
    "study_exercise_map_id": "sem_00030",
    "study_id": "stu_0010",
    "exercise_id": "ex_incline_dumbbell_press",
    "relationship_type": "movement_pattern_inference"
  },
  {
    "study_exercise_map_id": "sem_00031",
    "study_id": "stu_0011",
    "exercise_id": "ex_incline_dumbbell_press",
    "relationship_type": "movement_pattern_inference"
  },
  {
    "study_exercise_map_id": "sem_00032",
    "study_id": "stu_0012",
    "exercise_id": "ex_incline_dumbbell_press",
    "relationship_type": "movement_pattern_inference"
  },
  {
    "study_exercise_map_id": "sem_00033",
    "study_id": "stu_0004",
    "exercise_id": "ex_machine_chest_press",
    "relationship_type": "movement_pattern_inference"
  },
  {
    "study_exercise_map_id": "sem_00034",
    "study_id": "stu_0005",
    "exercise_id": "ex_machine_chest_press",
    "relationship_type": "movement_pattern_inference"
  },
  {
    "study_exercise_map_id": "sem_00035",
    "study_id": "stu_0007",
    "exercise_id": "ex_machine_chest_press",
    "relationship_type": "movement_pattern_inference"
  },
  {
    "study_exercise_map_id": "sem_00036",
    "study_id": "stu_0008",
    "exercise_id": "ex_machine_chest_press",
    "relationship_type": "movement_pattern_inference"
  },
  {
    "study_exercise_map_id": "sem_00037",
    "study_id": "stu_0009",
    "exercise_id": "ex_machine_chest_press",
    "relationship_type": "movement_pattern_inference"
  },
  {
    "study_exercise_map_id": "sem_00038",
    "study_id": "stu_0010",
    "exercise_id": "ex_machine_chest_press",
    "relationship_type": "movement_pattern_inference"
  },
  {
    "study_exercise_map_id": "sem_00039",
    "study_id": "stu_0011",
    "exercise_id": "ex_machine_chest_press",
    "relationship_type": "movement_pattern_inference"
  },
  {
    "study_exercise_map_id": "sem_00040",
    "study_id": "stu_0012",
    "exercise_id": "ex_machine_chest_press",
    "relationship_type": "movement_pattern_inference"
  },
  {
    "study_exercise_map_id": "sem_00041",
    "study_id": "stu_0004",
    "exercise_id": "ex_incline_machine_press",
    "relationship_type": "movement_pattern_inference"
  },
  {
    "study_exercise_map_id": "sem_00042",
    "study_id": "stu_0005",
    "exercise_id": "ex_incline_machine_press",
    "relationship_type": "movement_pattern_inference"
  },
  {
    "study_exercise_map_id": "sem_00043",
    "study_id": "stu_0007",
    "exercise_id": "ex_incline_machine_press",
    "relationship_type": "movement_pattern_inference"
  },
  {
    "study_exercise_map_id": "sem_00044",
    "study_id": "stu_0008",
    "exercise_id": "ex_incline_machine_press",
    "relationship_type": "movement_pattern_inference"
  },
  {
    "study_exercise_map_id": "sem_00045",
    "study_id": "stu_0009",
    "exercise_id": "ex_incline_machine_press",
    "relationship_type": "movement_pattern_inference"
  },
  {
    "study_exercise_map_id": "sem_00046",
    "study_id": "stu_0010",
    "exercise_id": "ex_incline_machine_press",
    "relationship_type": "movement_pattern_inference"
  },
  {
    "study_exercise_map_id": "sem_00047",
    "study_id": "stu_0011",
    "exercise_id": "ex_incline_machine_press",
    "relationship_type": "movement_pattern_inference"
  },
  {
    "study_exercise_map_id": "sem_00048",
    "study_id": "stu_0012",
    "exercise_id": "ex_incline_machine_press",
    "relationship_type": "movement_pattern_inference"
  },
  {
    "study_exercise_map_id": "sem_00049",
    "study_id": "stu_0004",
    "exercise_id": "ex_cable_fly",
    "relationship_type": "movement_pattern_inference"
  },
  {
    "study_exercise_map_id": "sem_00050",
    "study_id": "stu_0005",
    "exercise_id": "ex_cable_fly",
    "relationship_type": "movement_pattern_inference"
  },
  {
    "study_exercise_map_id": "sem_00051",
    "study_id": "stu_0007",
    "exercise_id": "ex_cable_fly",
    "relationship_type": "movement_pattern_inference"
  },
  {
    "study_exercise_map_id": "sem_00052",
    "study_id": "stu_0008",
    "exercise_id": "ex_cable_fly",
    "relationship_type": "movement_pattern_inference"
  },
  {
    "study_exercise_map_id": "sem_00053",
    "study_id": "stu_0009",
    "exercise_id": "ex_cable_fly",
    "relationship_type": "movement_pattern_inference"
  },
  {
    "study_exercise_map_id": "sem_00054",
    "study_id": "stu_0010",
    "exercise_id": "ex_cable_fly",
    "relationship_type": "movement_pattern_inference"
  },
  {
    "study_exercise_map_id": "sem_00055",
    "study_id": "stu_0011",
    "exercise_id": "ex_cable_fly",
    "relationship_type": "movement_pattern_inference"
  },
  {
    "study_exercise_map_id": "sem_00056",
    "study_id": "stu_0012",
    "exercise_id": "ex_cable_fly",